quid	description	exampleTrue	exampleFalse	run	subList	completionUrl	triple	name
c3d75d61-38d3-4a46-87b1-5227689d4dee	I think there is a shovel  which can roll/be used for rolling, but this is rare or uncommon.	I think there is a toddler  which can read/be used for reading, but this is rare or uncommon.	I think there is a teenager  which can read/be used for reading, but this is rare or uncommon.	4	1	https://piasommerauer.github.io/annotation	rare-roll-shovel	Agree or disagree (run4-expert_inspection2-batch1-40-40)
e5f8b206-34c4-4cf7-8f36-1177f7e62d99	I think it is impossible for (a/an) shovel to roll/be used for rolling.	I think it is impossible for (a/an) rock to float/be used for floating.	I think it is impossible for (a/an) metal to melt/be used for melting.	4	1	https://piasommerauer.github.io/annotation	impossible-roll-shovel	Agree or disagree (run4-expert_inspection2-batch1-40-40)
3e615222-b125-45b3-835f-7f334574d2e1	I know that (a/an) freebooter is dangerous as most or all other things similar to (a/an) freebooter are dangerous. 	I know that (a/an) wine is liquid as most or all other things similar to (a/an) wine are liquid. 	I know that (a/an) bread is liquid as most or all other things similar to (a/an) bread are liquid. 	4	1	https://piasommerauer.github.io/annotation	implied_category-dangerous-freebooter	Agree or disagree (run4-expert_inspection2-batch1-40-40)
7989db37-df69-4ef8-8366-538da79c5136	You can find (a/an) freebooter which is dangerous. (A/an) freebooter is usually either dangerous, a bit more or less dangerous or the opposite of dangerous.	You can find (a/an) knife which is sharp. (A/an) knife is usually either sharp, a bit more or less sharp or the opposite of sharp.	You can find (a/an) substance which is solid. (A/an) substance is usually either solid, a bit more or less solid or the opposite of solid.	4	1	https://piasommerauer.github.io/annotation	variability_open-dangerous-freebooter	Agree or disagree (run4-expert_inspection2-batch1-40-40)
7e216952-8060-49cd-b1e4-b7bf0ec730e1	You can find (a/an) pineapple which is yellow. Yellow is one of a few possible colors (a/an) pineapple usually has. There is only a limited range of possible colors.	You can find (a/an) pepper which is red. Red is one of a few possible colors (a/an) pepper usually has. There is only a limited range of possible colors.	You can find (a/an) t-shirt which is red. Red is one of a few possible colors (a/an) t-shirt usually has. There is only a limited range of possible colors.	4	1	https://piasommerauer.github.io/annotation	variability_limited-yellow-pineapple	Agree or disagree (run4-expert_inspection2-batch1-40-40)
7ab95ec2-dc98-4aa3-a012-792cb334c95a	I think (a/an) carrot can be red, but this is rare or uncommon.	I think (a/an) rose can be black, but this is rare or uncommon.	I think (a/an) rose can be yellow, but this is rare or uncommon.	4	1	https://piasommerauer.github.io/annotation	rare-red-carrot	Agree or disagree (run4-expert_inspection2-batch1-40-40)
131abbdc-5408-47c9-bd25-f37b131c5af0	Usually, (a/an) carrot is not red, but there could be a highly unusual situation in which (a/an) carrot is red.	Usually, (a/an) dog is not green, but there could be a highly unusual situation in which (a/an) dog is green.	Usually, (a/an) razor is not sharp, but there could be a highly unusual situation in which (a/an) razor is sharp.	4	1	https://piasommerauer.github.io/annotation	unusual-red-carrot	Agree or disagree (run4-expert_inspection2-batch1-40-40)
