conflict,triple,description,answer-antske,answer-pia,answer-piek,expected_behavior-antske,expected_behavior-pia,expected_behavior-piek,reason-antske,reason-pia,comment-piek
all,implied_category-arrow-fly,I know that (a/an) arrow can fly/be used for flying as most or all other things similar to (a/an) arrow fly. ,true,true,false,disagreement_agreement-disagreement_conceptualization,disagreement_conceptualization,disagreement_conceptualization,-,-,"""Not clear what the category is: flying objects, projectiles,..."
behavior,afforded_unusual-arrow-fly,All or most  arrow(s) can fly/be used for flying. This is not what they normally do or are used for. ,false,false,false,disagreement_agreement,disagreement_agreement,disagreement_conceptualization,"""some may say that arrows are usually just stored and only occasionally actually used.",-,"""anything launched will fly but arrows are designed for it. They do not fly like birds though."
behavior,rare-pin-roll,"I think there is a pin  which can roll/be used for rolling, but this is rare or uncommon.",false,false,false,,disagreement_agreement,disagreement_odd_triple,"""I don't think it is rare, but it is also not very common","""Possibly confused with: All/most pins can roll, but this is not what they usually do/are used for.","""Most pens roll but they are not designed for that purpose"
behavior,affording_activity-buttercup-yellow,I know that being yellow is necessary for many things (a/an) buttercup does or is used for. ,false,false,false,disagreement_agreement-disagreement_odd_triple,disagreement_odd_triple,disagreement_odd_triple,-,-,"""They are all yellow but this is not necessary. You could grow white buttercups through breeding I assume."
behavior,implied_category-tire-roll,I know that (a/an) tire can roll/be used for rolling as most or all other things similar to (a/an) tire roll. ,true,true,true,disagreement_conceptualization-disagreement_odd_triple,disagreement_conceptualization,disagreement_ambiguous_property,-,-,"""wheel and tire can be mixed"
none,typical_of_property-tire-roll,``Tire'' is one of the first things which come to mind when I hear ``roll' because (a/an) tire is a typical example of things which roll/are used for rolling'. ,false,false,false,disagreement_agreement,disagreement_agreement,disagreement_agreement,-,"""Possibly disagreement because of differences in how many typical things people think of. It is not among my top 3.","""Other more clear concepts come to mind for roll"
