relation,property,concept,answer,agreement,workerid,questionid,quid,description,exampletrue,examplefalse,run,sublist,completionurl,name,agreement
implied_category,roll,shovel,false,agree,gold labels,24534,9e3fdf25-0bea-40e9-9b36-6aaadbc53ec6,I know that (a/an) shovel can roll/be used for rolling as most or all other things similar to (a/an) shovel roll. ,I know that (a/an) dog can breathe/be used for breathing as most or all other things similar to (a/an) dog breathe. ,I know that (a/an) cat can meow/be used for meowing as most or all other things similar to (a/an) cat meow. ,4,1,https://piasommerauer.github.io/annotation,Agree or disagree (run4-expert_inspection2-batch1-40-40),agree
typical_of_property,roll,shovel,false,agree,gold labels,24535,1d02032d-4ddd-4570-a60b-0396ac5c4466,``Shovel'' is one of the first things which come to mind when I hear ``roll' because (a/an) shovel is a typical example of things which roll/are used for rolling'. ,``Baby'' is one of the first things which come to mind when I hear ``cry' because (a/an) baby is a typical example of things which cry/are used for crying'. ,``Teacher'' is one of the first things which come to mind when I hear ``walk' because (a/an) teacher is a typical example of things which walk/are used for walking'. ,4,1,https://piasommerauer.github.io/annotation,Agree or disagree (run4-expert_inspection2-batch1-40-40),agree
typical_of_concept,roll,shovel,false,agree,gold labels,24536,c194b642-1c57-40b8-b148-8bab362ebbb7,``Roll'' is one for the first things which come to mind when I hear ``shovel' because rolling is one of the typical movements of (a/an) shovel'.,``Cut'' is one for the first things which come to mind when I hear ``knife' because cuting is one of the typical activities of (a/an) knife'.,``Float'' is one for the first things which come to mind when I hear ``needle' because floating is one of the typical activities of (a/an) needle'.,4,1,https://piasommerauer.github.io/annotation,Agree or disagree (run4-expert_inspection2-batch1-40-40),agree
afforded_unusual,roll,shovel,false,agree,gold labels,24537,40f99cd0-f17c-414b-a197-cf873149ebb0,All or most  shovel(s) can roll/be used for rolling. This is not what they normally do or are used for. ,All or most  fork(s) can fight/be used for fighting. This is not what they normally do or are used for. ,All or most  brush(s) can fly/be used for flying. This is not what they normally do or are used for. ,4,1,https://piasommerauer.github.io/annotation,Agree or disagree (run4-expert_inspection2-batch1-40-40),agree
afforded_usual,roll,shovel,false,agree,gold labels,24538,fa980834-d6e3-4ef4-9ceb-f92a4e022237,I know that all or most shovel(s) roll regularly or are used for rolling regularly. ,I know that all or most candle(s) burn regularly or are used for burning regularly. ,I know that all or most T-shirt(s) wrap regularly or are used for wraping regularly. ,4,1,https://piasommerauer.github.io/annotation,Agree or disagree (run4-expert_inspection2-batch1-40-40),agree
variability_limited,roll,shovel,false,agree,gold labels,24539,34e0e2cd-259a-4bdd-8380-dee99ca64411,You can find (a/an) shovel which can roll/be used for rolling. This distinguishes a certain type of shovel from others. ,You can find (a/an) dog which can hunt/be used for hunting. This distinguishes a certain type of dog from others. ,You can find (a/an) dog which can breathe/be used for breathing. This distinguishes a certain type of dog from others. ,4,1,https://piasommerauer.github.io/annotation,Agree or disagree (run4-expert_inspection2-batch1-40-40),agree
creative,roll,shovel,false,agree,gold labels,24540,219cbdcc-ed4a-42f0-b922-1f536353be36,"I could say (a/an) shovel rolls/is used for rolling, but I would most certainly not mean it literally.","I could say (a/an) idea grows/is used for growing, but I would most certainly not mean it literally.
I could say (a/an) person glows/is used for glowing, but I would most certainly not mean it literally.
I could say (a/an) thought burns/is used for burning, but I would most certainly not mean it literally.","I could say (a/an) plant grows/is used for growing, but I would most certainly not mean it literally.
I could say (a/an) situation smiles/is used for smileing, but I would most certainly not mean it literally.
I could say (a/an) candle burns/is used for burning, but I would most certainly not mean it literally.",4,1,https://piasommerauer.github.io/annotation,Agree or disagree (run4-expert_inspection2-batch1-40-40),agree
unusual,roll,shovel,true,agree,gold labels,24541,3b92269d-a7d4-4fb3-bb56-7aab37aec132,"Usually, (a/an) shovel cannot roll/be used for rolling, but there could be a highly unusual situation in which (a/an) shovel can roll.","Usually, (a/an) dog cannot speak/be used for speaking, but there could be a highly unusual situation in which (a/an) dog can speak.","Usually, (a/an) dog cannot bark/be used for barking, but there could be a highly unusual situation in which (a/an) dog can bark.",4,1,https://piasommerauer.github.io/annotation,Agree or disagree (run4-expert_inspection2-batch1-40-40),agree
typical_of_property,dangerous,freebooter,false,agree,gold labels,24542,c2612c4d-23b6-4bb6-9697-6d3f93179ffb,``Freebooter'' is one of the first things which come to mind when I hear ``dangerous' because (a/an) freebooter is a typical example of things which are dangerous'. ,``Movie_star'' is one of the first things which come to mind when I hear ``famous' because (a/an) movie_star is a typical example of things which are famous'. ,``Mug'' is one of the first things which come to mind when I hear ``expensive' because (a/an) mug is a typical example of things which are expensive'. ,4,1,https://piasommerauer.github.io/annotation,Agree or disagree (run4-expert_inspection2-batch1-40-40),agree
typical_of_concept,dangerous,freebooter,true,agree,gold labels,24543,1be854f3-a63b-4782-9a71-8fe8517314f6,``Dangerous'' is one for the first things which come to mind when I hear ``freebooter' because dangerous is one of the typical evaluations of (a/an) freebooter'.,``Spicy'' is one for the first things which come to mind when I hear ``chili_pepper' because spicy is one of the typical tastes of (a/an) chili_pepper'.,``Sweet'' is one for the first things which come to mind when I hear ``spinach' because sweet is one of the typical tastes of (a/an) spinach'.,4,1,https://piasommerauer.github.io/annotation,Agree or disagree (run4-expert_inspection2-batch1-40-40),agree
affording_activity,dangerous,freebooter,ADD LABEL,ADD EXPECTATION,gold labels,24544,23319cf0-96f8-4844-8cb3-5d5b58f9b66c,I know that being dangerous is necessary for many things (a/an) freebooter does or is used for. ,I know that being sharp is necessary for many things (a/an) razor does or is used for. ,I know that being colorful is necessary for many things (a/an) dress does or is used for. ,4,1,https://piasommerauer.github.io/annotation,Agree or disagree (run4-expert_inspection2-batch1-40-40),ADD EXPECTATION
variability_limited,dangerous,freebooter,false,agree,gold labels,24545,1523b61b-e986-4505-97f6-c6adcc8cc4ff,You can find (a/an) freebooter which is dangerous. (A/an) freebooter is usually either dangerous or not dangerous. It cannot be a bit more or less dangerous.,You can find (a/an) substance which is solid. (A/an) substance is usually either solid or not solid. It cannot be a bit more or less solid.,You can find (a/an) cushion which is soft. (A/an) cushion is usually either soft or not soft. It cannot be a bit more or less soft.,4,1,https://piasommerauer.github.io/annotation,Agree or disagree (run4-expert_inspection2-batch1-40-40),agree
creative,dangerous,freebooter,false,agree,gold labels,24546,47d7d48a-7a79-4704-b099-fa694ba7754e,"I could say (a/an) freebooter is dangerous, but I would most certainly not mean it literally.","I could say (a/an) anger is hot, but I would most certainly not mean it literally.
I could say (a/an) person is cold, but I would most certainly not mean it literally.
I could say (a/an) story is dark, but I would most certainly not mean it literally.","I could say (a/an) fire is hot, but I would most certainly not mean it literally.
I could say (a/an) stone is heavy, but I would most certainly not mean it literally.
I could say (a/an) argument is liquid, but I would most certainly not mean it literally.",4,1,https://piasommerauer.github.io/annotation,Agree or disagree (run4-expert_inspection2-batch1-40-40),agree
rare,dangerous,freebooter,false,agree,gold labels,24547,4d5f94a4-9018-4789-9ad9-519dbb25a03f,"I think (a/an) freebooter can be dangerous, but this is rare or uncommon.","I think (a/an) pizza can be sweet, but this is rare or uncommon.","I think (a/an) pizza can be savory, but this is rare or uncommon.",4,1,https://piasommerauer.github.io/annotation,Agree or disagree (run4-expert_inspection2-batch1-40-40),agree
unusual,dangerous,freebooter,false,agree,gold labels,24548,8150b2cf-6a3e-45f0-89e3-5a776f267e02,"Usually, (a/an) freebooter is not dangerous, but there could be a highly unusual situation in which (a/an) freebooter is dangerous.","Usually, (a/an) pony is not blue, but there could be a highly unusual situation in which (a/an) pony is blue.","Usually, (a/an) beer is not brown, but there could be a highly unusual situation in which (a/an) beer is brown.",4,1,https://piasommerauer.github.io/annotation,Agree or disagree (run4-expert_inspection2-batch1-40-40),agree
impossible,dangerous,freebooter,false,agree,gold labels,24549,b80eea99-d167-4d78-a6dd-310d3cf9318f,I think it is impossible for (a/an) freebooter to be dangerous.,I think it is impossible for (a/an) water to be dry.,I think it is impossible for (a/an) rose to be white.,4,1,https://piasommerauer.github.io/annotation,Agree or disagree (run4-expert_inspection2-batch1-40-40),agree
implied_category,yellow,pineapple,false,agree,gold labels,24550,4f3df450-0d7f-4d7f-becf-d8a156423cb7,I know that (a/an) pineapple is yellow as most or all other things similar to (a/an) pineapple are yellow. ,I know that (a/an) chocoloate_cake is sweet as most or all other things similar to (a/an) chocoloate_cake are sweet. ,I know that (a/an) table is transparent as most or all other things similar to (a/an) table are transparent. ,4,1,https://piasommerauer.github.io/annotation,Agree or disagree (run4-expert_inspection2-batch1-40-40),agree
typical_of_property,yellow,pineapple,false,agree,gold labels,24551,76ec793e-58f6-44b5-9ca9-105a93ad3b3f,``Pineapple'' is one of the first things which come to mind when I hear ``yellow' because (a/an) pineapple is a typical example of things which are yellow'. ,``Rainbow'' is one of the first things which come to mind when I hear ``colorful' because (a/an) rainbow is a typical example of things which are colorful'. ,``Table'' is one of the first things which come to mind when I hear ``white' because (a/an) table is a typical example of things which are white'. ,4,1,https://piasommerauer.github.io/annotation,Agree or disagree (run4-expert_inspection2-batch1-40-40),agree
typical_of_concept,yellow,pineapple,true,agree,gold labels,24552,4507c836-79d7-4ec2-a242-3037dc9f0dad,``Yellow'' is one for the first things which come to mind when I hear ``pineapple' because yellow is one of the typical colors of (a/an) pineapple'.,``Spicy'' is one for the first things which come to mind when I hear ``chili_pepper' because spicy is one of the typical tastes of (a/an) chili_pepper'.,``Sweet'' is one for the first things which come to mind when I hear ``spinach' because sweet is one of the typical tastes of (a/an) spinach'.,4,1,https://piasommerauer.github.io/annotation,Agree or disagree (run4-expert_inspection2-batch1-40-40),agree
affording_activity,yellow,pineapple,false,agree,gold labels,24553,dee62f33-8983-4b4d-9a97-bfeac4fc1147,I know that being yellow is necessary for many things (a/an) pineapple does or is used for. ,I know that being pointy is necessary for many things (a/an) needle does or is used for. ,I know that being white is necessary for many things (a/an) t-shirt does or is used for. ,4,1,https://piasommerauer.github.io/annotation,Agree or disagree (run4-expert_inspection2-batch1-40-40),agree
variability_open,yellow,pineapple,false,agree,gold labels,24554,d3f29018-fc6a-4b7e-8743-234420a41bd9,You can find (a/an) pineapple which is yellow. Yellow is one of many possible colors (a/an) pineapple usually has. The range of colors is almost unlimited. ,You can find (a/an) t-shirt which is white. White is one of many possible colors (a/an) t-shirt usually has. The range of colors is almost unlimited. ,You can find (a/an) pepper which is green. Green is one of many possible colors (a/an) pepper usually has. The range of colors is almost unlimited. ,4,1,https://piasommerauer.github.io/annotation,Agree or disagree (run4-expert_inspection2-batch1-40-40),agree
creative,red,carrot,false,agree,gold labels,24555,6e641533-d51f-4d73-8d89-a2abc354744b,"I could say (a/an) carrot is red, but I would most certainly not mean it literally.","I could say (a/an) anger is hot, but I would most certainly not mean it literally.
I could say (a/an) person is cold, but I would most certainly not mean it literally.
I could say (a/an) story is dark, but I would most certainly not mean it literally.","I could say (a/an) fire is hot, but I would most certainly not mean it literally.
I could say (a/an) stone is heavy, but I would most certainly not mean it literally.
I could say (a/an) argument is liquid, but I would most certainly not mean it literally.",4,1,https://piasommerauer.github.io/annotation,Agree or disagree (run4-expert_inspection2-batch1-40-40),agree
impossible,red,carrot,false,agree,gold labels,24556,8169fb8e-4a53-4606-9f41-ef895454e0d4,I think it is impossible for (a/an) carrot to be red.,I think it is impossible for (a/an) steam to be solid.,I think it is impossible for (a/an) flame to be orange.,4,1,https://piasommerauer.github.io/annotation,Agree or disagree (run4-expert_inspection2-batch1-40-40),agree
implied_category,red,wine,false,agree,gold labels,24557,3dbcb361-b16f-4ad2-8075-e838a9820848,I know that (a/an) wine is red as most or all other things similar to (a/an) wine are red. ,I know that (a/an) chocoloate_cake is sweet as most or all other things similar to (a/an) chocoloate_cake are sweet. ,I know that (a/an) table is transparent as most or all other things similar to (a/an) table are transparent. ,4,1,https://piasommerauer.github.io/annotation,Agree or disagree (run4-expert_inspection2-batch1-40-40),agree
typical_of_property,red,wine,ADD LABEL,ADD EXPECTATION,gold labels,24558,ebdc2d5b-e5c3-4bad-8e8b-4254466492cc,``Wine'' is one of the first things which come to mind when I hear ``red' because (a/an) wine is a typical example of things which are red'. ,``Mouse'' is one of the first things which come to mind when I hear ``small' because (a/an) mouse is a typical example of things which are small'. ,``Dog'' is one of the first things which come to mind when I hear ``small' because (a/an) dog is a typical example of things which are small'. ,4,1,https://piasommerauer.github.io/annotation,Agree or disagree (run4-expert_inspection2-batch1-40-40),ADD EXPECTATION
typical_of_concept,red,wine,true,agree,gold labels,24559,d4a52f8d-1c3b-4906-bb59-9e2a7fee22b8,``Red'' is one for the first things which come to mind when I hear ``wine' because red is one of the typical colors of (a/an) wine'.,``Bitter'' is one for the first things which come to mind when I hear ``coffee' because bitter is one of the typical tastes of (a/an) coffee'.,``Salty'' is one for the first things which come to mind when I hear ``beer' because salty is one of the typical tastes of (a/an) beer'.,4,1,https://piasommerauer.github.io/annotation,Agree or disagree (run4-expert_inspection2-batch1-40-40),agree
affording_activity,red,wine,ADD LABEL,ADD EXPECTATION,gold labels,24560,8a1233c1-0a24-4910-bdd1-1f142be2f19d,I know that being red is necessary for many things (a/an) wine does or is used for. ,I know that being sharp is necessary for many things (a/an) razor does or is used for. ,I know that being colorful is necessary for many things (a/an) dress does or is used for. ,4,1,https://piasommerauer.github.io/annotation,Agree or disagree (run4-expert_inspection2-batch1-40-40),ADD EXPECTATION
variability_limited,red,wine,true,agree,gold labels,24561,3930f4c3-7d3e-4304-b01b-cc382d1032ec,You can find (a/an) wine which is red. Red is one of a few possible colors (a/an) wine usually has. There is only a limited range of possible colors.,You can find (a/an) apple which is green. Green is one of a few possible colors (a/an) apple usually has. There is only a limited range of possible colors.,You can find (a/an) car which is white. White is one of a few possible colors (a/an) car usually has. There is only a limited range of possible colors.,4,1,https://piasommerauer.github.io/annotation,Agree or disagree (run4-expert_inspection2-batch1-40-40),agree
variability_open,red,wine,false,agree,gold labels,24562,a6832b31-228a-4d6a-8e58-f5297ddb456a,You can find (a/an) wine which is red. Red is one of many possible colors (a/an) wine usually has. The range of colors is almost unlimited. ,You can find (a/an) dress which is white. White is one of many possible colors (a/an) dress usually has. The range of colors is almost unlimited. ,You can find (a/an) pea which is green. Green is one of many possible colors (a/an) pea usually has. The range of colors is almost unlimited. ,4,1,https://piasommerauer.github.io/annotation,Agree or disagree (run4-expert_inspection2-batch1-40-40),agree
creative,red,wine,false,agree,gold labels,24563,91f73b0b-618d-4b0e-85bf-47214e345c59,"I could say (a/an) wine is red, but I would most certainly not mean it literally.","I could say (a/an) anger is hot, but I would most certainly not mean it literally.
I could say (a/an) person is cold, but I would most certainly not mean it literally.
I could say (a/an) story is dark, but I would most certainly not mean it literally.","I could say (a/an) fire is hot, but I would most certainly not mean it literally.
I could say (a/an) stone is heavy, but I would most certainly not mean it literally.
I could say (a/an) argument is liquid, but I would most certainly not mean it literally.",4,1,https://piasommerauer.github.io/annotation,Agree or disagree (run4-expert_inspection2-batch1-40-40),agree
rare,red,wine,false,agree,gold labels,24564,dab950e9-e20c-441d-99a4-9475c2a9e9b2,"I think (a/an) wine can be red, but this is rare or uncommon.","I think (a/an) rose can be black, but this is rare or uncommon.","I think (a/an) rose can be yellow, but this is rare or uncommon.",4,1,https://piasommerauer.github.io/annotation,Agree or disagree (run4-expert_inspection2-batch1-40-40),agree
unusual,red,wine,false,agree,gold labels,24565,35429f27-e63a-4bdc-8d98-1665dee8ae3c,"Usually, (a/an) wine is not red, but there could be a highly unusual situation in which (a/an) wine is red.","Usually, (a/an) dog is not green, but there could be a highly unusual situation in which (a/an) dog is green.","Usually, (a/an) razor is not sharp, but there could be a highly unusual situation in which (a/an) razor is sharp.",4,1,https://piasommerauer.github.io/annotation,Agree or disagree (run4-expert_inspection2-batch1-40-40),agree
impossible,red,wine,false,agree,gold labels,24566,1c2e4d86-d0f2-460f-a0ed-fe78205014d0,I think it is impossible for (a/an) wine to be red.,I think it is impossible for (a/an) flame to be frozen.,I think it is impossible for (a/an) book to be light.,4,1,https://piasommerauer.github.io/annotation,Agree or disagree (run4-expert_inspection2-batch1-40-40),agree
